{
  "schemaVersion": "1.0.0",
  "kind": "materiaDefinition",
  "materiaDefinitionId": 1,
  "name": "Fire Materia",
  "category": 1,
  "element": 1,
  "rarityTier": 2,
  "maxLevel": 3,
  "enabled": true,
  "metadataRevision": 1,
  "verificationStatus": "confirmed",
  "notes": "Synced from live CityMateria.",
  "bonuses": [
    {
      "level": 1,
      "values": {
        "minDamageBonus": 1,
        "maxDamageBonus": 3,
        "heatGenerationBonus": 1
      }
    },
    {
      "level": 2,
      "values": {
        "minDamageBonus": 3,
        "maxDamageBonus": 5,
        "heatGenerationBonus": 2
      }
    },
    {
      "level": 3,
      "values": {
        "minDamageBonus": 5,
        "maxDamageBonus": 8,
        "heatGenerationBonus": 3
      }
    }
  ]
}
