{
  "schemaVersion": "1.0.0",
  "kind": "materiaDefinition",
  "materiaDefinitionId": 3,
  "name": "Stability Materia",
  "category": 3,
  "element": 11,
  "rarityTier": 2,
  "maxLevel": 3,
  "enabled": true,
  "metadataRevision": 1,
  "verificationStatus": "confirmed",
  "notes": "Synced from live CityMateria.",
  "bonuses": [
    {
      "level": 1,
      "values": {
        "stabilityBonus": 4,
        "cooldownMsBonus": -20
      }
    },
    {
      "level": 2,
      "values": {
        "stabilityBonus": 7,
        "cooldownMsBonus": -40
      }
    },
    {
      "level": 3,
      "values": {
        "stabilityBonus": 10,
        "cooldownMsBonus": -60
      }
    }
  ]
}
